Check,Card # ,Card Name ,Type ,Rarity ,Value,Attribute ,Sub Type ,Level ,ATK ,DEF ,Card Text
,PGD-093 ,Coffin Seller ,Trap ,Rare ,,,Continuous ,,,,"Each time your opponent's Monster Cards are sent to the Graveyard, inflict 300 points of Direct Damage to your opponent's Life Points."
,PGD-094 ,Curse of Aging ,Trap ,Common ,,,Normal ,,,,Discard 1 card from your hand. Decrease the ATK and DEF of all monsters on your opponent’s side of the field by 500 points until the end of the turn this card is activated.
,PGD-095 ,Barrel Behind the Door ,Trap ,Super Rare ,,,Counter ,,,,"When an effect that inflicts damage to Life Points is activated (except Battle Damage), switch the damage you receive to your opponent's Life Points."
,PGD-096 ,Raigeki Break ,Trap ,Short-Print Com ,,,Normal ,,,,Discard 1 card from your hand to the Graveyard to destroy 1 card on the field.
,PGD-097 ,Narrow Pass ,Trap ,Common ,,,Continuous ,,,,"This card can only be activated when both players have 2 monsters or less on either side of the field. Once this card is activated, both players can only Normal Summon or Set up to 2 additional monsters as long as this card remains face-up on the field."
,PGD-098 ,Disturbance Strategy ,Trap ,Common ,,,Normal ,,,,Your opponent puts all cards in his/her hand back into his/her Deck. The Deck is then shuffled. Your opponent then draws the same number of cards that he/she put into his/her Deck.
,PGD-099 ,Trap of Board Eraser ,Trap ,Super Rare ,,,Counter ,,,,"When an effect that inflicts damage to Life Points is activated (except Battle Damage), negate the damage to your Life Points. Your opponent then selects 1 card from his/her hand and discards it to his/her Graveyard."
,PGD-100 ,Rite of Spirit ,Trap ,Common ,,,Normal ,,,,"Select 1 Monster Card that includes ""Gravekeeper’s"" in its card name from your Graveyard and Special Summon it in face-up Attack or Defense Position. This card’s activation and effect is not affected by ""Necrovalley""."
,PGD-101 ,Non Aggression Area ,Trap ,Common ,,,Normal ,,,,"You can only activate this card during your Standby Phase. Discard 1 card from your hand to the Graveyard. Your opponent cannot Normal Summon, Set and/or Special Summon during the next turn."
,PGD-102 ,D. Tribe ,Trap ,Common ,,,Normal ,,,,All monsters on your side of the field are treated as Dragon-Types until the end of the turn this card is activated.
,PGD-103 ,Byser Shock ,Effect Monster ,Ultra Rare ,,Dark ,Fiend ,5,800,600,"When this card is Normal Summoned, Flip Summoned or Special Summoned, return all Set cards on the field to their owner's respective hands."
,PGD-104 ,Question ,Spell ,Ultra Rare ,,,Normal ,,,,"When activating this card, your opponent cannot check cards in the Graveyard. Your opponent calls the name of the first monster found at the bottom of your Graveyard. If he/she call it right, the monster is removed from play. If he/she call it wrong, the monster is Special Summoned on your side of the field in face-up Attack or Defense Position."
,PGD-105 ,Rope of Life ,Trap ,Ultra Rare ,,,Normal ,,,,This card can only be activated by discarding your entire hand when 1 of your own monsters is sent to the Graveyard as a result of battle. Special Summon the monster just sent to the Graveyard to the field in face-up Attack or Defense Position and increase its ATK by 800 points.
,PGD-106 ,Nightmare Wheel ,Trap ,Ultra Rare ,,,Continuous ,,,,"Select 1 monster. As long as the monster remains face-up on the field, the selected monster cannot attack or change its battle position except by the effect of a Magic, Trap or Effect Monster Card. This card inflicts 500 points of Direct Damage to your opponent's Life Points during each of his/her Standby Phases. When the selected monster is destroyed or removed from the field, this card is also destroyed."
,PGD-107 ,Lava Golem ,Effect Monster ,Secret Rare ,,Fire ,Fiend ,1,3000,2500,"This card must be Special Summoned on your opponent's side of the field by offering 2 monsters on your opponent's side of the field as a Tribute. This card inflicts 1000 points of Direct Damage to the Life Points of this card's controller during each of his/her Standby Phases. When you Special Summon this monster, you cannot Normal Summon or Set a monster during the same turn. "